{"schema_version":"goal-teams-test-run-result-v2.44","run_id":"RUN-V244-001","run_kind":"api","outcome":"passed","source_binding":{"commit":"bbbbbbbbbbbbbbbbbbbbbbbbbbbbbbbbbbbbbbbb","tree":"cccccccccccccccccccccccccccccccccccccccc","protected_snapshot_ref":{"path":"tests/v23/fixtures/v244/artifacts/evidence.json","sha256":"9ee77d386cb21a9617ebb741520f1d40f5e3ad3b93c317adafaa856bd0796447","discovery":{"kind":"artifact","selector":"protected-snapshot"}},"snapshot_sha256":"9ee77d386cb21a9617ebb741520f1d40f5e3ad3b93c317adafaa856bd0796447"},"runner_identity":{"agent_type":"goal_api_integration_test_runner","member_id":"member-api-runner","run_id":"RUN-V244-001","host_attestation_ref":{"path":"tests/v23/fixtures/v244/artifacts/evidence.json","sha256":"9ee77d386cb21a9617ebb741520f1d40f5e3ad3b93c317adafaa856bd0796447","discovery":{"kind":"artifact","selector":"runner-attestation"}},"designer_member_id":"member-api-designer","implementation_owner_member_id":"member-backend"},"plan_binding":{"plan_id":"PLAN-V244-API-E2E","revision":1,"sha256":"5565fd8e5ec4f4a25120ebe69e87e78df58eba011fb9bec6c05807049a07a292","artifact_ref":{"path":"tests/v23/fixtures/v244/artifacts/integration-test-plan.json","sha256":"5565fd8e5ec4f4a25120ebe69e87e78df58eba011fb9bec6c05807049a07a292","discovery":{"kind":"artifact","selector":"PLAN-V244-API-E2E"}}},"test_case_refs":[{"path":"tests/v23/fixtures/v244/artifacts/api-case.json","sha256":"17e21884b7e8ba749b61d386a2aa334b91af0bedd0abf9166ffe29adccfefefa","discovery":{"kind":"artifact","selector":"TC-V244-API-001"}}],"case_ids":["TC-V244-API-001"],"command":{"argv":["python3","scripts/run-v244-tests.py"],"cwd":"."},"environment":{"environment_id":"local-v244","base_url":"http://127.0.0.1:8244","runtime_fingerprint":"python=3.11.9;browser=chromium-127","dependency_fingerprint":"lock-sha256:aaaaaaaaaaaaaaaaaaaaaaaaaaaaaaaaaaaaaaaaaaaaaaaaaaaaaaaaaaaaaaaa","config_refs":[{"path":"tests/v23/fixtures/v244/artifacts/evidence.json","sha256":"9ee77d386cb21a9617ebb741520f1d40f5e3ad3b93c317adafaa856bd0796447","discovery":{"kind":"artifact","selector":"config"}}]},"data_refs":[{"path":"tests/v23/fixtures/v244/artifacts/evidence.json","sha256":"9ee77d386cb21a9617ebb741520f1d40f5e3ad3b93c317adafaa856bd0796447","discovery":{"kind":"artifact","selector":"seed"}}],"started_at":"2026-07-23T10:00:00Z","ended_at":"2026-07-23T10:00:02.500Z","duration_ms":2500,"exit_code":0,"summary":{"collected":1,"passed":1,"failed":0,"skipped":0,"flaky":0},"attempts":[{"attempt_id":"ATTEMPT-V244-001","ordinal":1,"reason":"initial","started_at":"2026-07-23T10:00:00Z","ended_at":"2026-07-23T10:00:02.500Z","duration_ms":2500,"exit_code":0,"outcome":"passed","case_results":[{"case_id":"TC-V244-API-001","outcome":"passed","consumed_inputs":{"idempotency_key":"REQ-244-001"},"observed":{"response":{"status":201,"body":{"state":"created"}},"post_state":{"order_count":1},"side_effects":["one durable order exists"]},"assertion_results":[{"assertion_id":"A-API-STATUS","comparator":"status_code_equals","actual":201,"expected":201,"passed":true},{"assertion_id":"A-API-AUTH","comparator":"equals","actual":true,"expected":true,"passed":true},{"assertion_id":"A-API-IDEMP","comparator":"equals","actual":1,"expected":1,"passed":true},{"assertion_id":"A-API-RETRY","comparator":"equals","actual":"created","expected":"created","passed":true},{"assertion_id":"A-API-CONCUR","comparator":"equals","actual":1,"expected":1,"passed":true},{"assertion_id":"A-API-COMP","comparator":"equals","actual":0,"expected":0,"passed":true},{"assertion_id":"A-API-FINAL","comparator":"equals","actual":"created","expected":"created","passed":true},{"assertion_id":"A-API-CLEANUP","comparator":"equals","actual":0,"expected":0,"passed":true}]}],"artifact_refs":[{"path":"tests/v23/fixtures/v244/artifacts/evidence.json","sha256":"9ee77d386cb21a9617ebb741520f1d40f5e3ad3b93c317adafaa856bd0796447","discovery":{"kind":"artifact","selector":"attempt"}}]}],"failures":[],"artifacts":[{"path":"tests/v23/fixtures/v244/artifacts/evidence.json","sha256":"9ee77d386cb21a9617ebb741520f1d40f5e3ad3b93c317adafaa856bd0796447","discovery":{"kind":"artifact","selector":"junit"}}],"retry":{"authorized":false,"attempted":false,"max_attempts":1,"reason_refs":[],"case_ids":[]},"flake":{"detected":false,"case_ids":[],"classification":"none"},"cleanup":{"command":{"argv":["python3","scripts/cleanup-v244-tests.py"],"cwd":"."},"status":"verified","observed":{"remaining_synthetic_orders":0},"evidence_refs":[{"path":"tests/v23/fixtures/v244/artifacts/evidence.json","sha256":"9ee77d386cb21a9617ebb741520f1d40f5e3ad3b93c317adafaa856bd0796447","discovery":{"kind":"artifact","selector":"cleanup"}}]},"replay":{"command":{"argv":["python3","scripts/run-v244-tests.py","--replay"],"cwd":"."},"environment_refs":[{"path":"tests/v23/fixtures/v244/artifacts/evidence.json","sha256":"9ee77d386cb21a9617ebb741520f1d40f5e3ad3b93c317adafaa856bd0796447","discovery":{"kind":"artifact","selector":"environment"}}],"seed_refs":[{"path":"tests/v23/fixtures/v244/artifacts/evidence.json","sha256":"9ee77d386cb21a9617ebb741520f1d40f5e3ad3b93c317adafaa856bd0796447","discovery":{"kind":"artifact","selector":"seed"}}],"deterministic":true,"evidence_refs":[{"path":"tests/v23/fixtures/v244/artifacts/evidence.json","sha256":"9ee77d386cb21a9617ebb741520f1d40f5e3ad3b93c317adafaa856bd0796447","discovery":{"kind":"artifact","selector":"replay"}}]}}
